{
  "collections": [
    {
      "artifact_path": "data/correction-overlay.v1.json",
      "collection_id": "correction_overlay",
      "content_sha256": "552fd1c6ae0e018304fb8add008b673d5cc0a86c25513bc3fa21a25d3d902f63",
      "count": 14,
      "file_sha256": "75a23b010cc54f7df945e491e71a6423d85f6919a8429c8946ebf126c3e828ad"
    },
    {
      "artifact_path": "data/index-records.v1.json",
      "collection_id": "index_records",
      "content_sha256": "c56454c499d0b85978877983df651d1f86447df72bbb277f6028291e810be42f",
      "count": 1904,
      "file_sha256": "cb78a0f528a3c7753870d2906ebd8f4a8a7f576e2e91bed85a1d7559f2ab9d28"
    },
    {
      "artifact_path": "data/source-subjects.v1.json",
      "collection_id": "source_subjects",
      "content_sha256": "0d5c70f535c858d4e1981377497cb3b1826590aee8cfbc61bd5c6d366932220f",
      "count": 638,
      "file_sha256": "fdfba1a2e22f870338606e6552073d31dfe3ce66ef0c3597daff5654ade5fb69"
    },
    {
      "artifact_path": "data/density.v1.json",
      "collection_id": "density",
      "content_sha256": "76d856e56842268ab20ef1be8c9ab6181dddcf9295d996ed92df8f2e8e6e7d27",
      "count": 17,
      "file_sha256": "cff732b7d0db03363b82f4502414a18c3eb0bf0e5189b9595da92d3f681e9592"
    }
  ],
  "correction_outcomes": {
    "adjusted_minor_defect_count": 3,
    "affected_headings": 14,
    "character_replacements": 18,
    "corrected_cross_reference_id": "XREF-9A63B6DC42BB",
    "cross_reference_gate_unchanged": true,
    "observed_minor_defect_count": 4,
    "readiness_unchanged": true,
    "remaining_unresolved_cross_reference_id": "XREF-6E6F54660707"
  },
  "evaluation_id": "ohfr-2002-original-published-index-v8",
  "item_summaries": {
    "adjusted": {
      "cross_references": {
        "bands": {
          "excellent": 15,
          "mixed": 0,
          "not_measured": 0,
          "poor": 1,
          "strong": 0,
          "weak": 0
        },
        "graded": 16,
        "not_measured": 0,
        "total": 16
      },
      "heading_nodes": {
        "bands": {
          "excellent": 1796,
          "mixed": 7,
          "not_measured": 0,
          "poor": 0,
          "strong": 95,
          "weak": 6
        },
        "graded": 1904,
        "not_measured": 0,
        "total": 1904
      },
      "locator_utility_tiers": {
        "diagnostic_credit": {
          "0": 72,
          "0.15": 22,
          "0.25": 18,
          "0.35": 1,
          "0.7": 1704,
          "1": 3521
        },
        "fit": {
          "exact_fit": 5150,
          "material_mismatch": 1,
          "material_partial_fit": 93,
          "no_fit": 72,
          "severe_mismatch": 22
        },
        "rating_credit": {
          "0": 206,
          "1": 5132
        },
        "treatment": {
          "absent": 72,
          "mixed": 1682,
          "substantive": 3560,
          "weak_presence": 24
        }
      },
      "locators": {
        "bands": {
          "excellent": 3521,
          "mixed": 1704,
          "not_measured": 0,
          "poor": 113,
          "strong": 0,
          "weak": 0
        },
        "graded": 5338,
        "not_measured": 0,
        "total": 5338
      },
      "paths": {
        "bands": {
          "excellent": 0,
          "mixed": 0,
          "not_measured": 1904,
          "poor": 0,
          "strong": 0,
          "weak": 0
        },
        "graded": 0,
        "not_measured": 1904,
        "total": 1904
      },
      "source_subjects": {
        "bands": {
          "excellent": 491,
          "mixed": 0,
          "not_measured": 0,
          "poor": 147,
          "strong": 0,
          "weak": 0
        },
        "graded": 638,
        "not_measured": 0,
        "total": 638
      }
    },
    "observed": {
      "cross_references": {
        "bands": {
          "excellent": 14,
          "mixed": 0,
          "not_measured": 0,
          "poor": 2,
          "strong": 0,
          "weak": 0
        },
        "graded": 16,
        "not_measured": 0,
        "total": 16
      },
      "heading_nodes": {
        "bands": {
          "excellent": 1795,
          "mixed": 7,
          "not_measured": 0,
          "poor": 0,
          "strong": 96,
          "weak": 6
        },
        "graded": 1904,
        "not_measured": 0,
        "total": 1904
      },
      "locator_utility_tiers": {
        "diagnostic_credit": {
          "0": 72,
          "0.15": 22,
          "0.25": 18,
          "0.35": 1,
          "0.7": 1708,
          "1": 3517
        },
        "fit": {
          "exact_fit": 5141,
          "material_mismatch": 1,
          "material_partial_fit": 102,
          "no_fit": 72,
          "severe_mismatch": 22
        },
        "rating_credit": {
          "0": 215,
          "1": 5123
        },
        "treatment": {
          "absent": 72,
          "mixed": 1682,
          "substantive": 3560,
          "weak_presence": 24
        }
      },
      "locators": {
        "bands": {
          "excellent": 3517,
          "mixed": 1708,
          "not_measured": 0,
          "poor": 113,
          "strong": 0,
          "weak": 0
        },
        "graded": 5338,
        "not_measured": 0,
        "total": 5338
      },
      "paths": {
        "bands": {
          "excellent": 0,
          "mixed": 0,
          "not_measured": 1904,
          "poor": 0,
          "strong": 0,
          "weak": 0
        },
        "graded": 0,
        "not_measured": 1904,
        "total": 1904
      },
      "source_subjects": {
        "bands": {
          "excellent": 491,
          "mixed": 0,
          "not_measured": 0,
          "poor": 147,
          "strong": 0,
          "weak": 0
        },
        "graded": 638,
        "not_measured": 0,
        "total": 638
      }
    }
  },
  "limitations": [
    "The representation-adjusted view is a deterministic counterfactual projection, not a replacement for the canonical as-delivered V8 result.",
    "Restricted detailed artifacts are used only as validated local build inputs; their public hashes are retained, but the files themselves remain uncommitted.",
    "Current V8 causal-provenance artifacts supply the detailed collection source and are hash-bound to the public result.",
    "The representation corrections are presentation-only under the percentage-native V8 report and do not create a separately recalculated score.",
    "Aggregate scores are taken from the authoritative V8 calculation and are not reconstructed by averaging item grades."
  ],
  "projection_id": "OHFR-V8-WEB-B7909CA7E772",
  "projection_role": "deterministic_public_safe_display_projection",
  "projection_sha256": "2c3dd5bffbb789f12da23ce4a44b3f6d8e86b4f1a7d4e759f58d53f434fddb94",
  "provenance": {
    "benchmark_sha256": "558980b374ca4b162b12f2726e237319b170f9e8b7014f71ad7c2171e9e98983",
    "calculation_sha256": "03f3e0f8c03b69187fc8db0595b495b0a3b3e4575ee1863c14585e488c0a8811",
    "correction_overlay_sha256": "552fd1c6ae0e018304fb8add008b673d5cc0a86c25513bc3fa21a25d3d902f63",
    "dimension_calculation_profile": "subject-index-dimension-calculation-v5",
    "judgment_policy_sha256": "06e879c589d8e86b04ebaf3f637d307b2fb5cbeb7bda4f71c63e97e57381730d",
    "missing_access_audit_set_sha256": "d54b3d5db5d166f9844f9ffde9d639b44454ee8ae041dda1a29e140503f25014",
    "projection_metadata_sha256": "7da16acd1bc19e599194f36dfd421d7007a23c72ea54ee61b40ff9a87e18148f",
    "rubric_version": "subject-index-rubric-v8",
    "source_artifacts": [
      {
        "artifact_path": "source/source-benchmark.v2.json",
        "availability": "restricted_local_build_input_not_committed_under_candidate/v8",
        "sha256": "f58fae3d56c427fcac8771d8ca4181f98a9d496096e35ea1d130e200567a816c"
      },
      {
        "artifact_path": "scoring/dimension-calculations.v6.json",
        "availability": "restricted_local_build_input_not_committed_under_candidate/v8",
        "sha256": "b501b297ad212c956c4db3de734b93735e2ec8d3fa0071802f43fba01d87fa79"
      },
      {
        "artifact_path": "candidates/<candidate-id>/candidate-index.v2.json",
        "availability": "restricted_local_build_input_not_committed_under_candidate/v8",
        "sha256": "7b29d7716339038848e2b1b0ec17220ae1867cb95941f0f06a84488cd486ed79"
      },
      {
        "artifact_path": "candidate/representation-adjustment/character-fidelity-audit.v1.json",
        "availability": "public_committed",
        "sha256": "bee81248c0361684f723bb11c4568ee7786c2866b00544645da0c48b8e7ec7ec"
      },
      {
        "artifact_path": "source/chunk-manifest.json",
        "availability": "restricted_local_build_input_not_committed_under_candidate/v8",
        "sha256": "5287f421e1e7be03444c2681beb1e1d63d5d103a96ab770565e32411956ce396"
      },
      {
        "artifact_path": "candidate/representation-adjustment/correction-causal-ledger.v1.json",
        "availability": "public_committed",
        "sha256": "1b06021fd4d2185094780da97bfbefbfe17eaf59ae849cbbc277e7f1bc99f20b"
      },
      {
        "artifact_path": "candidates/<candidate-id>/item-inventory.v2.json",
        "availability": "restricted_local_build_input_not_committed_under_candidate/v8",
        "sha256": "3e9c2b20d49486398bd57bfa31f5d1da1743498b47d0b9e46e42f096b56b9934"
      },
      {
        "artifact_path": "scoring/item-assessments.v7.json",
        "availability": "restricted_local_build_input_not_committed_under_candidate/v8",
        "sha256": "d85e21c0a1e4c285a8707d7d4bfa0cbc1066df482f3f74ede6498132cf8e82db"
      },
      {
        "artifact_path": "candidates/<candidate-id>/missing-access-audits/missing-access-audit.CHUNK-001.v1.json",
        "availability": "restricted_local_build_input_not_committed_under_candidate/v8",
        "sha256": "0bf1614ecd1af0e54b14d96eb72b25cd34621f0c4590991ce95065e929b3c3af"
      },
      {
        "artifact_path": "candidates/<candidate-id>/missing-access-audits/missing-access-audit.CHUNK-002.v1.json",